<?xml version="1.0" encoding="UTF-8"?>
 <!DOCTYPE table 
PUBLIC "-//mybatis.org//DTD MyBatis Test Configuration 1.0//EN" 
"methodGenerate.dtd"> 
<table tableName="tb_intf_api_main">
<method methodType="u" resultForQuery="1">
		<and>
			<column name="name"  paramType="Between">
			</column>
		</and>
		<ors>
			<or>
				<column name="url1" paramType="Like">
				</column>
				<column name="url2" paramType="Like">
				</column>
			</or>
			<or>
				<column name="url3" paramType="Like">
				</column>
			</or>
		</ors>
	</method>
	
</table>
